No,Istilah,Definisi
731,legal reasoning,"alasan-alasan hukum yang dipakai dalam rangka membuat keputusan hukum yang meliputi setting ketika putusan hukum dibuat, proses reasoning dan filosofi hukum (judicial philosophies)."
732,legally binding agreement,"persetujuan yang mengikat secara hukum; suatu perjanjian atau kontrak yang telah memenuhi semua unsur bagi sahnya perjanjian, dan atau telah dibuat sesuai dengan persyaratan formal sebagaimana ditentukan dalam perundang-undangan, sehingga dengan demikian kontrak itu mempunyai akibat hukum bagi para pihak yang membuatnya."
733,legally binding agreement/persetujuan yang mengikat secara hukum,"suatu perjanjian atau kontrak yang telah memenuhi semua unsur bagi sahnya perjanjian, dan atau telah dibuat sesuai dengan persyaratan formal sebagaimana ditentukan dalam perundangundangan, sehingga dengan demikian kontrak itu mempunyai akibat hukum bagi para pihak yang membuatnya."
734,legitieme portie (bagian mutlak),"suatu bagian dari harta peninggalan yang harus diberikan kepada para ahli waris dalam garis lurus menurut undang-undang, terhadap mana si pewaris tidak diperbolehkan menetapkan sesuatu, baik selaku pemberian antara yang masih hidup maupun selaku wasiat. [vide: Pasal 913 KUH Perdata]."
735,legitimatie,"pernyataan sah, pengesahan; sah menurut hukum."
736,legitimatiepapier,"cek, wesel, surat berharga tidak atas nama."
737,legitimus,sesuai dengan hukum.
738,lelang,1. penjualan barang-barang di muka umum dan diberikan pada penawar tertinggi; 2. penjualan di hadapan orang banyak (dng tawaran yg atas-mengatasi) dipimpin oleh pejabat lelang; 3. penjualan barang yang terbuka untuk umum dengan penawaran harga secara tertulis dan/atau lisan yang semakin meningkat atau menurun untuk mencapai harga tertinggi yang didahului dengan pengumuman lelang. [PMK Nomor 93/PMK.06/2010 tentang Petunjuk Pelaksanaan Lelang].
739,lembaga (negara),organisasi non-kementerian negara dan instansi lain pengguna anggaran yang dibentuk untuk melaksanakan tugas tertentu berdasarkan Undang-Undang Dasar Negara Republik Indonesia Tahun 1945 atau peraturan perundang-undangan lainnya.
740,lembaga arbitrase,badan yang dipilih oleh para pihak yang bersengketa untuk memberikan putusan mengenai sengketa tertentu; lembaga tersebut juga dapat memberikan pendapat yang mengikat mengenai suatu hubungan hukum tertentu dalam hal belum timbul sengketa.
741,lembaga atau badan lain,"antara lain badan hukum milik negara, yayasan yang mendapat fasilitas negara, komisi-komisi yang dibentuk dengan undang-undang, dan badan swasta yang menerima dan/atau mengelola uang negara [vide: UU No. 15/2006, Penjelasan Pasal 6 ayat (1)]."
742,lembaga bipartit,forum komunikasi dan konsultasi mengenai hal-hal yang berkaitan dengan hubungan industrial di satu perusahaan yang anggotanya terdiri dari pengusaha dan serikat pekerja/serikat buruh yang sudah tercatat instansi yang bertanggung jawab di bidang ketenagakerjaan atau unsure pekerja/buruh.
743,lembaga keuangan,semua badan yang melalui kegiatan-kegiatannya di bidang keuangan menarik uang dari dan menyalurkannya ke dalam masyarakat. (Pasal 1 Angka 2 UU Nomor 14 Tahun 1967 tentang Pokok-Pokok Perbankan).
744,lembaga perwakilan,"DPR, DPD, DPRD Provinsi, dan/atau DPRD Kabupaten/Kota sebagaimana dimaksud dalam Undang-Undang Dasar Negara Republik Indonesia Tahun 1945."
745,lembaga tripartit,"forum komunikasi, konsultasi dan musyawarah tentang masalah ketenagakerjaan yang anggotanya terdiri dari unsur organisasi pengusaha, serikat pekerja/serikat buruh, dan pemerintah."
746,lembaran negara,penerbitan resmi dari negara yang memuat semua perundang-undangan baru untuk diumumkan agar resmi diketahui oleh umum.
747,lender of the last resort,sebagai tempat peminjaman yang terakhir.
748,lepas dari segala tuntutan/onslag van rechtvervolging,putusan yang dijatuhkan oleh majelis hakim karena perbuatan yang didakwakan kepada terdakwa terbukti tetapi perbuatan itu bukan merupakan tindak pidana.
749,letter of credit (L/C),"1. perjanjian atau pernyataan sepihak dari issuing bank kepada bank korespondennya atau bank lainnya yang ditunjuk oleh bank koresponden tersebut bahwa bila eksportir telah mengapalkan barangnya kepada importir dan semuanya dilaksanakan sesuai dengan syarat-syarat yang ditetapkan dalam l/c tersebut, maka issuing bank akan membayarkan proceeds dari l/c tersebut kepada beneficiary, yakni orang yang berhak menerima pembayaran; 2. surat yang memuat kesediaan Bank untuk membayar tagihan atas kehendak nasabahnya sesuai syarat-syarat yang ditentukan pembeli dan menyerahkan kepada penjual dengan melampirkan daftar pesanan barang; bila barang telah dikirim kepada pembeli maka penjual dapat mengirim surat tagihan kepada pembeli."
750,letter of patent,"surat paten; surat bukti pemberian paten oleh instansi yang berwenang untuk itu, yaitu kantor paten, kepada pemohon paten setelah melalui prosedur tertentu sebagaimana ditetapkan oleh undang-undang paten; surat hak paten dari pemerintah."
751,lettre de change,surat wesel [Pasal 100 dan 101 KUHD].
752,levering,"suatu perbuatan yuridis guna memindahkan hak milik yang caranya tergantung dari macamnya barang; penyerahan barang atau hak [BW Pasal 612, 1475, WvS Pasal 127]."
753,levy,"menjatuhkan pajak, menyita; tindakan berupa penyitaan atas suatu benda berdasarkan prosedur hukum, misalnya eksekusi, tindakan berupa penjatuhan pajak terhadap suatu objek kena pajak."
754,lewat waktu,daluarsa.
755,lex commissora,syarat batal yang tegas dicantumkan/tidak tegas dicantumkan dalam surat perjanjian timbal balik jika salah satu pihak tidak memenuhi kewajibannya/lalai dalam perjanjian itu [Pasal 1266 KUHPerdata]; syarat perjanjian menjadi batal karena kealpaan salah satu pihak.
756,lex domicili,undang-undang setempat; hukum yang berlaku dimana hukum itu dibuat.
757,lex fori,sistem hukum dari tempat dimana persoalan hukum diajukan sebagai perkara; hukum yang berlaku adalah hukum dari negara dimana pengajuan gugatan dimasukkan.
758,lex generalis,"hukum/peraturan umum; undang-undang atau hukum, atau peraturan yang bersifat umum."
759,lex imperfecta,undang-undang/peraturan yang tidak ada sanksinya.
760,lex loci actus,"undang-undang dari tempat dimana perbuatan itu dilakukan; hukum yang berlaku disuatu negara, dimana tindak pidana itu dilakukan. (Kamus Hukum, Yan Pramadya Puspa, Aneka Ilmu)."
761,lex loci contractus,undang-undang dari tempat dimana perjanjian dibuat.
762,lex loci delicti,penentuan kualitas suatu perbuatan sebagai perbuatan melawan hukum atau tidak harus dilakukan berdasarkan hukum dari tempat perbuatan itu dilakukan.
763,lex loci domocilii/lex patriae,hukum yang mengatur hak serta kewajiban perorangan adalah hukum dari tempat seseorang berkediaman tetap.
764,lex loci solutionis,sistem hukum yang digunakan dari tempat pelaksanaan perjanjian; Hukum dari tempat terjadinya suatu transaksi.
765,lex locus actus,asas hukum yang berkenaan dengan tempat perbuatan hukum dilakukan.
766,lex locus solutionis,tempat perjanjian diselesaikan.
767,lex naturalis/hukum alam,hukum yang berlaku di setiap tempat dan di setiap waktu atau hukum yang berlaku di mana saja dan kapan saja.
768,lex non scripta,hukum yang tak tertulis.
769,lex posterior derogat legi priori,hukum yang kemudian membatalkan hukum yang terdahulu.
770,lex rei sitae/lex situs,hukum yang harus diberlakukan atas suatu benda adalah hukum dari tempat benda terletak atau berada.
771,lex situs rei,asas hukum yang berlaku berkenaan dengan letak benda terutama dengan benda tetap.
772,lex specialis derogat lex generalis,asas hukum yang menentukan bahwa peraturan perundang-undangan yang bersifat khusus mengesampingkan ketentuan perundang-undangan yang bersifat umum.
773,lex superior derogat legi inferior,suatu asas hukum yang menentukan bahwa hukum yang derajatnya lebih tinggi membatalkan hukum yang derajatnya lebih rendah.
774,"lex, undang-undang, hukum","undang-undang, hukum, hukum positif, system hukum yang tertulis, hukum kodifikasi dalam suatu negara."
775,liability/tanggung jawab hukum,tanggung jawab hukum; pertanggungjawaban menurut hukum yang timbul sebagai akibat dari suatu perbuatan atau peristiwa hukum.
776,licentie,"surat izin (lisensi); ijin untuk mendapatkan, membeli, atau hak sesuatu."
777,lien,"hak retensi, hak reklame, hak jaminan; tindakan secara hukum untuk membuat sesuatu benda sebagai jaminan bagi terpenuhinya suatu tuntutan atau tagihan; hak memegang barang jaminan."
778,lingkungan pengendalian,kondisi lingkungan organisasi yang menetapkan corak suatu organisasi dan mempengaruhi kesadaran akan pengendalian.
779,lisensi,"suatu bentuk hak untuk melakukan satu atau serangkaian tindakan atau perbuatan yang diberikan oleh mereka yang berwenang dalam bentuk izin. tanpa adanya izin tersebut, maka tindakan atau perbuatan tersebut merupakan suatu tindakan yang terlarang, yang tidak sah, yang merupakan perbuatan melawan hukum."
780,lisensi (hukum perdata),"perjanjian tertulis pemberian hak untuk menikmati manfaat ekonomi suatu paten atau merek dalam jangka waktu tertentu dengan pembayaran royalti kepada pemegang paten atau merek, dengan ketentuan pemegang paten atau merek tetap boleh melaksanakan sendiri atau memberi lisensi kepada pihak ketiga lainnya untuk melaksanakan paten atau menggunakan merek guna memperoleh keuntungan ekonomi."
781,litigasi,tindakan hukum membawa perkara ke pengadilan.
782,loan,"pinjaman (uang), peminjaman, penyerahan sejumlah uang dari pemiliknya kepada pihak lain dengan perjanjian bahwa peminjam akan mengembalikan dengan bunga tertentu serta dalam jangka waktu tertentu."
783,loan value,"nilai pinjaman, suatu nilai yang ditetapkan oleh bank atau lembaga pemberi kredit atas sekuritas yang dijaminkan."
784,locus cotractus/locus solutionis,tempat pembuatan atau pelaksanaan kontrak.
785,locus delicti,tempat terjadinya suatu tindak pidana.
786,lokalisasi,"pembatasan aktifitas sesuatu pada suatu tempat saja demi untuk memudahkan pengaturan, pengawasan dsb."
787,lump sum contract,kontrak lamsam; kontrak yang pemenuhan atau pelaksanaan prestasinya harus dilaksanakan secara penuh sebelum pembayaran dapat dimintakan kegagalan untuk melaksanakan prestasi secara utuh mengakibatkan pembayaran tak dapat dimintakan.
788,maatschap,"perseroan, persekutuan, maskapai, perserikatan."
789,makelaar,"makelar, pedagang perantara, pialang; broker."
790,makelaar in effecten,"pedagang perantara efek, makelar efek, pialang efek yang memenuhi syarat-syarat yang ditentukan oleh Menteri Keuangan [vide: SK. Menkeu RI No. 401/KMK.011/1979], yaitu : (1) harus badan hukum Indonesia yang berkedudukan di Indonesia; (2) lembaga keuangan bukan bank; (3) perorangan yang mempunyai keahlian dan/atau berpengalaman dalam perdagangan efek yang diselenggarakan oleh BAPEPAM."
791,malpractice,"kealpaan profesi, malpraktek."
792,mampu - kemampuan aset/asset coverage,"kemampuan aset perusahaan untuk membayar kembali utang dan kewajiban lain dari pendapatan yang diterima, yang tercermin dalam nisbah (rasio) aktiva terhadap utang jangka panjang."
793,mandatory,"1. orang atau pemerintah yang mendapatkan amanat, pemangku amanat; mandataris; 2. bersifat perintah atau penugasan, wajib."
794,manifes/manifest,daftar muatan kapal yang diperlukan untuk pemeriksaan bea cukai.
795,mark down,penurunan harga jual suatu barang.
796,mark up,"dalam konteks bisnis, hal ini menunjukkan terjadinya pembengkakan nilai atau harga proyek atau penggelembungan anggaran untuk mendapatkan pinjaman dari bank melebihi kebutuhan."
797,masa bebas pajak/tax holiday,perangsang investasi berupa pembebasan pajak perseroan dan/atau pajak dividen untuk jangka waktu tertentu (antara 2 sampai 6 tahun) berdasarkan Undang-Undang Nomor 1 tahun 1967 dan Undang-Undang Nomor 6 tahun 1968.
798,masa tenggang/grace periode,kelonggaran waktu dalam pembayaran kembali angsuran pinjaman pokok dan/atau bunga yang disepakati oleh kedua pihak; masa tenggang ini diperkirakan cukup untuk mencapai tingkat produksi yang memungkinkan bagi dimulainya pembayaran sebagian pinjaman dan bunga tanpa berpengaruh pada modal kerja perusahaan.
799,mata uang/currency,uang beredar dalam bentuk uang kertas dan uang logam yang merupakan alat pembayaran yang sah.
800,matematis,"hal-hal yang berkaitan dengan angka, seperti perhitungan dengan nilai."
801,materialitas,"besarnya informasi akuntansi yang apabila terjadi penghilangan atau salah saji, dilihat dari keadaan yang melingkupinya, mungkin dapat mengubah atau mempengaruhi pertimbangan orang yang meletakkan kepercayaan atas informasi tersebut."
802,matrealitas,suatu kondisi tidak tersajikannya atau salah saji suatu informasi akan mempengaruhi keputusan atau penilaian pengguna yang dibuat atas dasar laporan keuangan. Matrealitas tergantung pada hakikat atau besarnya pos atau kesalahan yang dipertimbangkan dari keadaan khusus dimana kekurangan atau salah saji terjadi.
803,memorandum,1. catatan singkat untuk membantu mengingat suatu transaksi atau kejadian lain; 2. nota atau catatan diplomatik.
804,memorandum of understanding (MoU),"kesepakatan, surat pernyataan tentang saling pengertian yang biasa dikeluarkan setelah tercapainya kesepakatan antar dua pihak atau lebih mengenai sesuatu hal."
805,menteri/pimpinan lembaga,pejabat yang bertanggung jawab atas pengelolaan keuangan kementerian negara/lembaga yang bersangkutan.
806,merger,penggabungan atau peleburan dua atau lebih perusahaan secara bersama-sama.
807,merger bank/bank merger,"penggabungan dua bank atau lebih, dengan cara tetap mempertahankan berdirinya salah satu bank dan membubarkan bank-bank lainnya dengan atau tanpa melikuidasi."
808,merger horisontal/horizontal merger,"bentuk penggabungan dua atau lebih perusahaan, baik yang memproduksi barang maupun jasa menjadi satu perusahaan."
809,merk,"merek, tanda yang berupa gambar, nama, kata, huruf-huruf, angka-angka, susunan warna atau kombinasi dari unsur-unsur tersebut yang memiliki daya pembeda dan digunakan dalam kegiatan perdagangan barang atau jasa [vide: UU No. 15/2001, Pasal 1 angka 1]."
810,merk perusahaan/product mark,merek yang dilekatkan pada produk oleh produsennya.
811,milik - kepemilikan tunggal/sole proprietorship,"bentuk kepemilikan perusahaan yang secara mutlak dimiliki dan dikendalikan secara keseluruhan oleh satu orang; di Indonesia dikenal dengan perusahaan dalam bentuk firma atau CV; pada Undang-Undang Nomor 1 Tahun 1995 tentang Perseroan Terbatas, kepemilikan tunggal atas suatu perusahaan yang berbentuk perseroan terbatas dilarang."
812,milik - pemilik barang sewa/lessor,orang yang menjadi pemilik barang dalam perjanjian sewa beli (leasing).
813,milik - pemilik/proprietor,orang yang memiliki suatu usaha.
814,milik - pemilikan kembali/repossession,"penyitaan atas agunan tambahan dalam rangka mengamankan suatu pinjaman jika debitur lalai melunasi kewajibannya; hal itu dilakukan apabila segala upaya penagihan telah gagal; namun, biasanya taksiran nilai agunan tambahan ditetapkan lebih rendah daripada nilai pasar sehingga debitur dapat menuntut kembali barang yang telah dijadikan agunan tambahan tersebut setelah melalui keputusan pengadilan."
815,misrepresentation,"penyajian yang salah, memberikan penjelasan dengan data-data yang salah, untuk maksud yang kurang baik."
816,mitra aktif/active partner,peserta dalam persekutuan komanditer yang mempunyai wewenang kepengurusan dan bertanggung jawab secara tanggung renteng dengan kekayaan pribadi kepada pihak ketiga.
817,mitra pasif/pasive partner,peserta dalam persekutuan komanditer yang tidak mempunyai wewenang kepengurusan dan tanggung jawabnya hanya terbatas sampai jumlah uang yang dimasukkan dalam persekutuan.
818,modal berwujud/tangible net worth,modal saham setelah dikurangi muhibah (good will) dan aktiva tak-berwujud lainnya yang merupakan indikasi kemampuan meminjam suatu bank atau lembaga tabungan.
819,modal dasar/authorized capital,jumlah modal yang disebutkan dalam anggaran dasar perseroan terbatas yang sudah mendapatkan pengesahan dari instansi yang berwenang.
820,modal disetor/paid up capital,"modal yang telah disetor secara efektif oleh pemiliknya; bagi bank yang berbadan hukum koperasi, modal disetor terdiri atas simpanan wajib dan modal penyertaan sebagaimana diatur dalam Undang-Undang Nomor 25 Tahun 1992 tentang Perkoperasian."
821,modal ditempatkan/issued capital; subscribed,bagian modal dasar suatu perseroan terbatas yang tertera dalam anggaran dasar yang merupakan kewajiban para pemegang sahamnya dan telah disanggupi untuk disetor.
822,modal pinjaman/loan capital,"utang yang didukung oleh instrumen atau warkat yang memiliki sifat seperti modal dan mempunyai ciri-ciri: a. tidak dijamin oleh bank yang bersangkutan, dipersamakan dengan modal yang telah dibayar penuh; b. tidak dapat dilunasi atau ditarik atas inisiatif pemilik tanpa persetujuan Bank Indonesia; c. mempunyai kedudukan yang sama dengan modal dalam hal jumlah kerugian bank melebihi laba ditahan dan cadangan-cadangan yang termasuk dalam modal inti meskipun bank belum dilikuidasi; dan d. pembayaran bunga dapat ditangguhkan apabila bank dalam keadaan rugi atau labanya tidak mendukung untuk membayar bunga tersebut; pengertian modal pinjaman tersebut termasuk cadangan modal yang berasal dari penyetoran modal yang efektif oleh pemilik yang belum didukung oleh modal dasar yang mencukupi, dan tidak termasuk instrumen utang (debt instrument) pasar modal beserta semua derivatifnya; untuk bank yang berbadan hukum koperasi, pengertian modal pinjaman sesuai dengan ketentuan yang diatur dalam Undang-Undang Nomor 25 Tahun 1992 tentang Perkoperasian; dulu disebut modal kuasi."
823,modal saham/capita/stack,modal perusahaan yang berasal dari penjualan saham-saham yang dikeluarkan oleh perusahaan; dana yang diperoleh dari hasil penjualan saham ini adalah menjadi modal pokok dari perusahaan.
824,modal tetap/fixed capital,"modal perusahaan yang tertanam dalam harta tetap, hak paten, dan muhibah (goodwill), tanah dan mesin-mesin, serta saham dan surat berharga lainnya."
825,modal ventura/venture capital,"penyertaan modal ke dalam suatu perusahaan pasangan usaha untuk (a) mengembangkan penemuan baru, (b) mengembangkan perusahaan yang pada tahap awal usahanya mengalami kesulitan dana, (c) membantu perusahaan yang berada pada tahap pengembangan, (d) membantu perusahaan yang berada pada tahap kemunduran usaha, (e) mengembangkan proyek penelitian dan rekayasa, (f) mengembangkan berbagai penggunaan teknologi baru dan alih teknologi baik dari dalam maupun luar negeri, dan (g) membantu pengalihan pemilikan perusahaan penyertaan modal dalam setiap perusahaan pasangan usaha bersifat sementara dan tidak boleh melebihi jangka waktu sepuluh tahun penarikan kembali penyertaan modal (divestasi) oleh perusahaan modal ventura dalam segala bentuknya dilaporkan kepada Menteri Keuangan selambat-lambatnya tiga bulan setelah dilaksanakan."
826,money laundring,"pencucian uang, kejahatan yang dilakukan oleh perorangan atau korporasi dalam batas wilayah negara atau lintas batas wilayah negara berupa tindak pidana korupsi, penyuapan, penyelundupan imigrasi, perbankan,perdagangan gelap narkotika dan psikotropika, perdagangan budak, wanita dan anak, perdagangan senjata gelap, penculikan, terorisme, pencurian, penggelapan dan berbagai kejahatan krah putih, dengan mengupayakan agar harta kekayaan yang diperoleh dari kejahatan tersebut masuk ke dalam sistem perbankan agar tidak dapat dilacak [vide: UU No. 15/2005, UU No. 31/1999, UU No. 20/2001]."
827,monopoli/monopoly,keadaan pasar barang tertentu yang penawarannya dikuasai oleh seorang atau sekelompok penjual yang menguasai atau menentukan tingkat harga atau jumlah barang atau jasa.
828,monopsoni/monopsony,keadaan pasar barang tertentu yang pembelinya hanya dilakukan oleh seorang atau sekelompok pembeli sehingga dapat menentukan tingkat harga.
829,moratorium/moratorium,"penundaan waktu jatuh tempo wesel, utang-utang, dan kewajiban lain yang diputuskan oleh pemerintah terhadap kreditur karena adanya krisis keuangan; penundaan atas suatu tindakan atau proses."
830,mortgage/gadai benda tetap,sama seperti hipotik atau hak tanggungan benda tetap untuk pelunasan suatu hutang.
831,nasabah debitur,1. nasabah debitur; 2. nasabah yang memperoleh fasilitas kredit atau pembiayaan berdasarkan Prinsip Syariah atau yang dipersamakan dengan itu berdasarkan perjanjian bank dengan nasabah yang bersangkutan nasabah yang menempatkan dananya di bank dalam bentuk simpanan berdasarkan perjanjian bank dengan nasabah yang bersangkutan.
832,nasionalisasi/nationalization,pengambilalihan dan pengaturan kepemilikan usaha yang dimiliki swasta oleh pemerintah untuk kepentingan negara yang pelaksanaannya ditetapkan oleh putusan pemerintah.
833,national bank system,sistem perbankan nasional.
834,national income,dapat - pendapatan nasional.
835,negative covenant/janji negatif,suatu ketentuan dalam suatu perjanjian kerja atau perjanjian jual-beli dalam hal pihak pekerja atau penjual diikat dengan janji untuk tidak bersaing di suatu wilayah atau pasar yang sama.
836,negative pledge/janji pembatasan,dalam hukum perusahaan berarti janji sebuah perusahaan untuk tidak melakukan penjaminan ulang yang hanya akan menguntungkan kreditor lain.
837,negative verification/verifikasi negatif,"rumusan suatu pasal dalam sebuah kontrak atau surat tagihan yang menyatakan bahwa setelah lewat waktu tertentu tak ada keberatan atau bantahan dari nasabah atau pihak yang dituju oleh surat tersebut, maka pernyataan atau fakta yang tertera dalam surat tersebut dianggap sebagai benar."
838,negligence/kelalaian/kealpaan,"kegagalan dalam melakukan suatu kewajiban yang sebenarnya dapat dilakukan oleh orang biasa atau oleh orang yang berhati-hati; atau melakukan sesuatu yang oleh orang yang berpikiran sehat dan hati-hati tidak akan dilakukan; ketidakhati-hatian, sembrono."
839,negotiating bank,bank penegosiasi.
840,nepotisme,"setiap perbuatan penyelenggara negara secara melawan hukum yang menguntungkan kepentingan keluarganya dan atau kroninya di atas kepentingan masyarakat, bangsa, dan negara."
841,neraca,"laporan yang menyajikan informasi posisi keuangan pemerintah, yang meliputi aset, utang, dan ekuitas dana pada tanggal tertentu."
842,neraca awal,"neraca yang disusun pertama kali oleh pemerintah. Neraca Awal menunjukkan nilai aset, kewajiban, dan ekuitas dana pada tanggal neraca awal."
843,neraca konsolidasi/consolidated balance sheet,neraca yang menggambarkan aktiva dan pasiva bersih secara keseluruhan dari induk beserta anak perusahaan.
844,neraca pembayaran transfer/balance of transfer payment,"ikhtisar yang menunjukkan selisih antara penerimaan dan pengeluaran devisa yang tidak merupakan hasil pemberian jasa, seperti sumbangan, kiriman uang untuk anak sekolah atau keluarga."
845,neraca pembayaran/balance of payment,"pencatatan secara sistematis semua transaksi ekonomi antara penduduk suatu negara dan penduduk negara lain yang menimbulkan pembayaran antar negara dalam jangka waktu tertentu, biasanya satu tahun; suatu neraca pembayaran dikatakan surplus apabila terdapat kelebihan dana dan perdagangan dan investasi dibandingkan dengan kewajiban-kewajiban yang dibayarkan kepada negara lain; akibatnya, terjadi suatu apresiasi nilai mata uang negara tersebut terhadap nilai mata uang negara lain; sebaliknya, neraca pembayaran dikatakan defisit apabila terdapat kelebihan impor terhadap ekspor, suatu ketergantungan terhadap investor asing, dan terjadi penilaian terlalu tinggi terhadap mata uang negara tersebut (overvalued) negara yang mengalami neraca pembayaran defisit wajib menutupi defisit/kekurangan itu dengan mengekspor emas atau cadangan mata uang kuat (hardcurrency reserves), misalnya dollar AS, yang diterima sebagai alat pembayaran hutang luar negeri."
846,neraca perdagangan/balance of trade,ikhtisar yang menunjukkan selisih antara nilai transaksi ekspor dan impor suatu negara dalam jangka waktu tertentu.
847,neraca/balanced sheet,"ikhtisar yang menggambarkan posisi harta, kewajiban, dan modal sendiri suatu badan usaha pada saat tertentu; disebut neraca karena kenyataannya terjadi keseimbangan antara harta di satu pihak dengan kewajiban dan modal di pihak lain."
848,net asset,"kekayaan bersih suatu organisasi, perusahaan atau perorangan setelah dikurangi dengan pembayaran seluruh kewajiban atau tagihan-tagihan dalam pajak."
849,net income,penghasilan yang diperoleh dari kegiatan usaha atau pekerjaan setelah dikurangi dengan semua biaya pengeluaran dan pajak.
850,nietig,"batal, menjadi gugur atau tidak berlaku lagi; batal dengan sendirinya."
851,nietigverklaring,"dinyatakan tidak berlaku, dinyatakan gugur; nultification."
852,nilai - penilaian tingkat kesehatan bank/bank rating,"penilaian berdasarkan pendekatan kualitatif atas berbagai aspek yang berpengaruh terhadap kondisi dari perkembangan suatu bank, yaitu penilaian atas faktor-faktor permodalan, kualitas aktiva produktif manajemen, rentabilitas, dan likuiditas."
853,nilai buku/book value,"nilai aset perusahaan yang tertera pada catatan perakunan, umumnya tidak sama dengan nilai pasar; biasanya, yang dicatat adalah harga ketika aset tersebut dibeli; setiap tahun nilai aset tersebut dikurangi/didepresiasikan dan pengurangan nilai tersebut dibebankan pada pendapatan perusahaan; nilai buku adalah biaya dikurangi akumulasi depresiasi."
854,nilai intrinsik moneter,nilai asli yang melekat pada fisiknya misalnya nilai emas yang terdapat pada uang logam emas.
855,nilai jaminan/collateral value,nilai taksiran oleh bank terhadap barang jaminan yang diserahkan oleh debitur.
856,nilai jatuh tempo/materity value,sejumlah uang yang harus dibayar pada saat jatuh tempo sesuai dengan persyaratan dalam perjanjian.
857,nilai kini bersih/net present value,selisih antara nilai kini arus dana dan biaya investasi.
