No,Istilah,Definisi
348,fasilitas kredit bank/bank credit,sejumlah uang yang diciptakan oleh bank dalam bentuk kredit dan cerukan melalui sarana kredit dari diskonto yang diberikan dengan atau tanpa kolateral; jumlah yang dicairkan diawasi oleh bank sentral.
349,fasilitas penarikan kredit/line of credit,janji sebuah bank untuk meminjamkan dana kepada seorang peminjam sampai jumlah tertentu dalam jangka waktu tertentu pada masa datang serta dengan persyaratan tertentu.
350,fidusia/fiduciare eigendemsoverdracht/FEO,"1. pengalihan hak kepemilikan suatu benda atas dasar kepercayaan dengan ketentuan bahwa benda yang hak kepemilikannya dialihkan tersebut tetap dalam penguasaan pemilik benda [UU No. 42/1999]; 2. pengikatan barang bergerak sebagai jaminan kredit, barang jaminan dikuasai oleh debitur, tetapi kepemilikannya diserahkan atas dasar kepercayaan kepada kreditur."
351,fiktif,"bersifat fiksi, tidak sesuai dengan kenyataan, tidak nyata, hanya terdapat di khayalan; sesuatu yang diada-adakan atau dikarang-karang atau dibuat-buat, misalnya pembayaran fiktif, kegiatan fiktif."
352,firma/venootchap,persekutuan dagang yang didirikan untuk menjalankan suatu perusahaan dengan memakai satu nama bersama; dalam persekutuan dagang ini tiap peserta secara sendiri atau bersama-sama bertanggung jawab atas segala perikatan yang dibuat atas nama persekutuan dagang tersebut.
353,fiskal/fiscal,"hal mengenai keuangan, terutama yang berkenaan dengan urusan pajak atau pendapatan negara."
354,fit and proper,"evaluasi terhadap integritas pemegang saham pengendali serta evaluasi terhadap integritas, kompetensi, dan independensi pengurus dalam mengendalikan kegiatan operasional bank."
355,force majeure,"keadaan yang terjadi di luar kemampuan manusia sehingga kerugian tidak dapat dihindari, seperti banjir dan gempa bumi."
356,force majeure/keadaan kahar/keadaan memaksa,situasi atau peristiwa yang terjadi di luar batas kemampuan dan dugaan manusia.
357,forensik,"1. berkenaan dengan pengadilan atau perdebatan publik; 2. bersifat argumentasi, retorik; 3. berkenaan dengan penerapan pengetahuan ilmiah pada masalah hukum."
358,franchise/waralaba,"perjanjian untuk mengelola suatu bisnis antara dua pihak yang intinya berupa pemberian lisensi hak milik intelektual seperti hak paten, hak cipta, hak merek, rahasia dagang, yang disertai pula dengan sistem dan metode pengelolaan usahanya baik di bidang barang maupun jasa."
359,franco,syarat-syarat penyerahan barang dalam penentuan harga yang menyatakan semua ongkos sampai di tempat yang disebut ditanggung penjual.
360,fraud,"penipuan, kekurangan, penggelapan."
361,free on board (FOB),istilah pengangkutan yang berarti bahwa dalam harga faktur sudah termasuk penyerahan sampai suatu titik tertentu atas beban penjual.
362,free zone/daerah bebas bea,"sebagian dari wilayah negara biasanya bagian dari pelabuhan, wilayah pergudangan atau daerah tertentu yang ditetapkan pemerintah yang pada umumnya dianggap terletak di luar wilayah negara itu untuk tujuan pabean; barang impor boleh dimasukkan ke wilayah tersebut tanpa membayar bea cukai sambil menunggu pengolahan, pengapalan transit, atau untuk di re-ekspor."
363,frozen account,"pemblokiran rekening seseorang oleh pemerintah atau oleh aparat penguasa yang berwenang karena berbagai sebab, misalnya sedang dalam pemeriksaan kasus korupsi, pencucian uang."
364,frozen asset,aset atau harta kekayaan yang dibekukan dalam arti tidak dapat diuangkan karena perintah pengadilan atau masih dalam proses sengketa.
365,fund,dana atau sejumlah surat-surat berharga dan harta kekayaan lainnya yang disediakan untuk maksud tertentu sesuai dengan keinginan yang telah direncanakan.
366,funding,"suatu proses mengkonversikan utang jangka pendek dengan bunga tetap ke utang jangka panjang bagi pendanaan oleh otoritas keuangan untuk menurunkan likuiditas dari sistem perbankan, dan bagi perusahaan alat untuk meningkatkan likuiditas jangka pendek."
367,gadai,"suatu hak yang diperoleh seorang berpiutang atas suatu barang bergerak yang diserahkan kepadanya oleh seorang berhutang atau oleh seorang lain atas namanya barang tersebut secara didahulukan dari pada orang-orang berpiutang lainnya; Jika pihak yang berhutang tidak membayar hutangnya, barang tak bergerak yang dipakai sebagai jaminan dijual didepan umum; dengan putusan (persetujuan) Hakim barang tak bergerak tersebut dapat diambil oleh pihak (orang) yang berpiutang [KUH Pdt Psl.1150]."
368,gadai - gadai ulang/herbelening,penyerahan barang jaminan nasabah kepada bank lain sebagai jaminan atas kredit yang ditarik oleh bank yang menyerahkan barang jaminan tersebut.
369,gadai/pand,hak tanggungan atas barang bergerak; barang jaminan harus lepas dari kekuasaan debitur.
370,gadai; surat gadai,"surat yang dibuat oleh pihak yang menggadai (pandhuis, bank, dan lain sebagainya), dengan isi pernyataan tentang barang yang digadai, nilai uang gadai, dan lain sebagainya, dipegang oleh pihak yang menggadaikan barang sewaktu penebusan dan terjadi masalah yang menyangkut dengan barang yang digadaikan dapat dipakai sebagai bukti."
371,ganti kerugian,"hak seorang untuk mendapat pemenuhan atas tuntutannya yang berupa imbalan sejumlah uang karena ditangkap, ditahan, dituntut ataupun diadili tanpa alasan yang berdasarkan undang-undang atau karena kekeliruan mengenai orangnya atau hukum yang diterapkan menurut cara yang diatur dalam undang-undang ini."
372,ganti kerugian (negara),"sejumlah uang atau barang yang dapat dinilai dengan uang yang harus dikembalikan kepada negara/daerah oleh seseorang atau badan yang telah melakukan perbuatan melawan hukum baik sengaja maupun lalai (vide: UU No. 15/2006, Psl 1 angka 16)."
373,ganti; penggantian (conversi),"ketentuan-ketentuan konversi seperti yang tercantum pada Undang-Undang Pokok Argaria adalah mengenai hak-hak atas tanah yang sebelumnya Undang-Undang Pokok Agraria (UUPA) tersebut di undangkan di Indonesia terdapat bermacam-macam hak-hak atas tanah; dengan diundangkannnya UUPA tersebut sekarang hanya dikenal 7 macam hak-hak atas tanah di Indonesia : 1. hak milik; 2. hak guna usaha; 3. hak guna bangunan;  4. hak pakai; 5. hak sewa; 7. hak membuka tanah; 8. hak memungut hasil hutan. Untuk menyeragamkan hukum atas tanah di indonesia bekas jajahan pemerintah Belanda sepertinya ada hak opstal, hak eigendom, hak erfpacht dan lain sebagainya harus dikonversikan menjadi salah satu hak seperti yang tercantum pada UUPA tersebut diatas (UU No. 5/1960 Bagian Kedua Psl.1 IX; bagian ketiga, keempat dan kelima)."
374,ganti; penggantian kerugian (indemniteit/schadeloosstelling),"1. dalam halnya seorang pengacara, pembela, penasehat ataupun wakilnya diminta oleh seorang yang meminta bantuan hukum mengenai upah atau ganti kerugiannya harus ditanggung oleh pihak yang meminta bantuan hukum tersebut [vide: RIB Psl. 379]; 2. melarikan perempuan ataupun seorang gadis baik atas kemauan perempuan itu sendiri ataupun tidak/tanpa kemauan orang tuanya adalah merupakan tindak pidana yang dapat dituntut; tindak pidana ini merupakan klacht delict atau delik aduan [vide: KUHP Psl. 332]."
375,garansi; jaminan (zekerheid; cautie waarborg; garantie),"memaksa dengan kekerasan atau ancaman agar seseorang bertindak, berbuat atau melakukan sesuatu atau sama sekali tidak melakukan sesuatu dengan melawan hak perbuatan itu merupakan tindak pidana yang si pelakunya dapat dituntut ; (delik pengaduan) ~KUHP Psl. 335"
376,garant/borg (bld)/guarantor (ing),penanggung ; penjamin
377,gebrekige getuige (bld)/fault witness (ing),"saksi yang tidak menghadap; Saksi yang diperintahkan menghadap kesidang pengadilan tidak 9mau) datang dan tidak memberikan alasan yang sah Hakim dapat memerintahkan sekali lagi, kalau perlu untuk dibawa serta (RIB Psl.80)."
378,giro bilyet/giro biljet,surat dengan bentuk tententu berisi permintaan nasabah kepada bank untuk memindahbukukan dananya kepada pihak lain.
379,giro/checking accounts,"simpanan yang penarikannya dapat dilakukan setiap saat dengan dengan menggunakan cek, bilyet giro, sarana perintah pembayaran lainnya, atau dengan pemindahbukuan."
380,grace period/masa tenggang,kelonggaran waktu dalam melakukan pengembalian pinjaman pokok dan atau bunganya selama jangka waktu tertentu yang diperlukan guna mencapai suatu tahap tertentu bagi usaha yang bersangkutan agar tidak memberatkan perusahaan tersebut.
381,grantificatie (bld),"(pemberi) hadiah; Gratification (ing), - hadiah uang."
382,grants/hibah,"1. perbuatan hukum memberikan atau mengalihkan sesuatu hak atau benda oleh seseorang ke orang lain tanpa diimbangi dengan prestasi sebaliknya dari pihak yang diberi tersebut; pemberian atau pengalihan suatu hak secara cuma-cuma; hadiah;  2. dalam arti hukum perdata hanyalah dapat mengenai benda-benda yang sudah ada – jika hibah itu diperuntukkan benda-benda yang baru akan ada dikemudian maka sekedar mengenai itu hubahnya adalah menjadi batal; 3. suatu persetujuan antara penghibah (pemberi hibah) dengan penerima hibah untuk memberikan benda-benda yang sudah ada dengan cuma-cuma dimana mereka masih hidup, misalnya hibah antara kedua calon suami istri; 4. hibah wasiat, pemberian dari penghibah kepada penerima hibah dengan lisan (dikatakan) atau tertulis sebagai wasiat atau pesan terakhir sebelum penghibah meninggal dunia – hibah wasiat itu sendiri barulah berlaku setelah penghibah meninggal dunia."
383,gratifikasi PNS,"pemberian dalam arti luas yakni meliputi pemberian uang, barang, rabat (discount), komisi, pinjaman tanpa bunga, tiket perjalanan yang dilakukan baik di dalam maupun di luar negeri dan dilakukan dengan menggunakan sarana elektronik atau tanpa sarana elektronik kepada pegawai negeri sipil yang dianggap sebagai pemberian suap, apabila berhubungan dengan jabatannya dan yang berlawanan dengan kewajiban atau tugasnya."
384,group boycott/boikot grup,persekongkolan di antara para pengusaha untuk tidak menjalin hubungan bisnis dengan pengusaha lain; tindakan ini tergolong tidak baik karena membatasi kebebasan individu untuk meneruskan sendiri apakah ia akan menjalin hubungan bisnis atau tidak dengan pengusaha yang dikenai boikot grup tersebut.
385,guarantee,1. jaminan pihak ketiga untuk menanggung utang atau kewajiaban pihak tertentu apabila ternyata kewajiban tersebut tidak dipenuhi sampai batas waktu yang ditentukan; 2. jaminan pihak penjual atau supplier kepada pembeli berupa perbaikan cuma-Cuma atau mengganti barang yang rusak.
386,guarantee bond,"obligasi yang dijamin, jenis obligasi yang diterbitkan oleh anak  perusahaan yang dijamin dengan sejumlah aktiva perusahaan tersebut disertai jamianan tambahan dari perusahaan induknya."
387,guarantee clause,suatu ketentuan atau klausula dalam kontrak penjaminan pihak ketiga bahwa dia menjamin akan membayar kewajiban dari debitur.
388,guarantee fund,uang jaminan.
389,guarantor,penjamin
390,"guardian (ing), - pengampu; wali; yang menjadi wali/wakil, curator (bld)","pengampu; wali; guardian; curator; istri yang ditinggal mati suaminya dalam keadaan hamil setelah dipanggil/diperiksa oleh yang kompeten, maka Balai Harta Peninggalan (kantor : Wees Kamer) dapat menjadi pengampu si istri tadi demi untuk menyelamatkan, megurus harta kekayaan untuk kepentingan si anak dikemudian hari [vide: KUH Pdt Psl. 348]; Curator atau pengampu dari seorang gila bila mana si gila itu melakukan perbuatan yang menimbulkan akibat hukum si curator dapat dituntut membayar ganti rugi dan lain sebagainya [vide: RIB Psl. 3 bg]."
391,gugat rekonvensi,gugatan yang diajukan oleh tergugat terhadap penggugat dalam sengketa yang sedang berjalan antara mereka.
392,gugat; menggugat (ind),menggugat; menuduh; istilah menggugat lebih tepat diterapkan dalam kasus sengketa perkara perdata atau perkara sipil; dalam kasus pidana atau perkara kejahatan dipakai istilah : menuduh; mendakwa.
393,gugatan balasan (ind); - reconventie,dalam halnya seseorang mendapat gugatan iapun berhak memasukkan atau mengajukan gugatan balasan atau gugatan melawan; gugatan aseli yang telah diajukan ke Pengadilan kepada pihak yang mungkin akan mengadukan gugatan balasan itu dinamakan : conventie.
394,gugatan pajak,upaya hukum terhadap pelaksanaan penagihan pajak sebagaimana diatur dalam peraturan perundang-undangan perpajakan yang bersangkutan.
395,gugatan perseroan,"gugatan yang khusus terbit dalam hukum perseroan, bukan dari hukum acara pada umumnya."
396,gugatan provisional,suatu gugatan untuk memperoleh tindakan sementara selama proses perkara masih berlangsung.
397,gugatan tata usaha negara,permohonan yang berisi tuntutan terhadap badan atau pejabat tata usaha negara dan diajukan ke pengadilan untuk mendapatkan keputusan.
398,H.I.R (Herziene Indonesische Reglement),H.I.R itu berasal dari I.R. atau INLANDSCHE REGLEMENT yang dimuat dalam Stbl thn 1848 – no. 16 jo 57.
399,hak (ind)/Cedent (bld)/ Assignor (ing),"yang memindahkan hak; Cessionaris (bld)/Cessionary; Abandonee (ing), - yang menerima hak."
400,hak alih bayar/recourse,hak seorang pemegang surat berharga untuk memaksa pengendos sebelumnya atas suatu warkat untuk memenuhi kewajibannya berupa pembayaran jika penerbit warkat cedera janji.
401,hak atas kekayaan intelektual (HAKI),"biasa juga disebut hak milik intelektual, mencakup hak cipta (copy right), hak paten (patent) dan merk dagang (trademark). karya-karya intelektual tersebut merupakan gagasan asli yang dihasilkan oleh, umpamanya, industri fotografi, industri ilmiah, industri komputer dan piranti lunak, industri elektronik, industri kendaraan bermotor termasuk cadangannya, industri huburan seperti buku, film, rekaman suara dan video, industri kimia serta industri farmasi. tanpa pengakuan atas hak ini, para pemilik hak karya intelektual dirugikan oleh perbanyakan atau peniruan karya-karya cipta mereka yang dilakukan tanpa meminta ijin dan tanpa pembayaran biaya lisensi serta royalti (uang jasa) pada mereka."
402,hak atas merek,"hak khusus yang diberikan negara kepada pemilik merek yang terdaftar dalam daftar umum merek untuk jangka waktu tertentu menggunakan sendiri merek tersebut, atau memberi ijin kepada seseorang atau beberapa orang secara bersama-sama atau badan hukum untuk menggunakannya."
403,hak atas tanah,"hak yang memberikan kewenangan untuk mempergunakan tanah yang bersangkutan, demikian pula tubuh bumi dan air serta ruang yang ada di atasnya, sekedar diperlukan untuk kepentingan yang berhubungan dengan penggunaan tanah itu."
404,hak beheer,"hak yang tanahnya selain dipergunakan untuk kepentingan instansi yang bersangkutan, dimaksudkan juga untuk dapat diberikan dengan sesuatu hak kepada pihak ketiga."
405,hak beli kembali/pre-emption,hak penjual untuk membeli kembali barang yang telah dijualnya dengan didahulukan daripada calon pembeli lain apabila barang tersebut akan dijual lagi.
406,hak cipta/copy right (ing),"hak eksklusif bagi pencipta atau penerima hak untuk mengumumkan atau memperbanyak ciptaannya atau memberikan izin untuk itu dengan tidak mengurangi pembatasan-pembatasan menurut peraturan perundang-undangan yang berlaku; para penulis (pengarang) dan pencipta seni lainnya hak-hak cipta mereka dilindungi oleh undang-undang; manakala seseorang (pihak lain) menjiplak, mengintip atau mencuri hak cipta orang lain tersebut atas perbuatannya itu merupakan kejahatan atau tindak pidana yang dapat dituntut (KUHP Psl.380)."
407,hak derivatif/derivative right,hak yang diberikan atau dimiliki oleh pemegang saham minoritas agar dapat melakukan tindakan tertentu dalam menjaga atau mewakili perseroan terhadap tindakan organ lainnya dalam perseroan bila kepentingan perseroan dirugikan.
408,hak gadai/lien,"hak kreditur atas harta tertentu sebagai jaminan piutangnya; misalnya, sebuah rumah yang diikat dengan hak tanggungan, apabila tidak dibayar tepat pada waktunya, maka rumah yang dijaminkan bisa dieksekusi untuk melunasi utangnya."
409,hak guna bangunan,"hak untuk mendirikan dan mempunyai bangunan-bangunan atas tanah yang bukan miliknya sendiri, dengan jangka waktu paling lama 30 tahun."
410,hak guna usaha,"hak untuk mengusahakan tanah yang dikuasai langsung oleh negara dalam jangka waktu paling lama 25 tahun guna perusahaan pertanian, perikanan, atau peternakan, dapat diperpanjang dengan waktu paling lama 25 tahun."
411,hak jaminan,"memberi kepada yang berhak/kreditor hak didahulukan untuk mengambil pelunasan dari hasil penjualan barang yang dibebani, seperti gadai, hipotek, credietverband, hak tanggungan atas tanah, hak fiducia, dan lain-lain."
412,hak kebendaan/zakelijkrec,"hak yang memberikan kekuasaan langsung atas suatu benda dan dapat dipertahankan terhadap siapa pun, misalnya hak milik, hak hipotek, dan hak jaminan utang."
413,hak memungut hasil,"hak untuk menarik (memungut) hasil dari benda orang lain, seolah-olah benda itu miliknya sendiri, dengan kewajiban untuk menjaga benda tersebut tetap dalam keadaan seperti semula."
414,hak menikmati hasil/usufruct,hak memakai dan menikmati hasil suatu benda milik orang lain tanpa hak untuk memilikinya.
415,hak mutlak/absolute title,"hak tertinggi yang dapat diperoleh melalui pendaftaran hak, misalnya melalui pendaftaran tanah. hak ini bersifat mutlak sehingga tidak dapat dicabut oleh pihak mana pun; di Indonesia hak atas tanah berfungsi sosial."
416,hak oktroi/paten/patent,hak kepemilikan yang diberikan oleh pemerintah kepada seseorang atas apa yang diciptakan disertai dengan perlindungan hukum terhadap kemungkinan timbulnya pemalsuan oleh pihak lain.
417,hak pakai,"hak untuk menggunakan dan/atau memungut hasil dari tanah yang dikuasai langsung oleh negara atau tanah milik orang lain, yang memberi wewenang dan kewajiban yang ditentukan dalam keputusan pemberiannya oleh pejabat yang berwenang memberikannya atau dalam perjanjian dengan pemilik tanahnya, yang bukan perjanjian sewa-menyewa atau perjanjian pengolahan tanah, segala sesuatu asal tidak bertentangan dengan jiwa dan ketentuan-ketentuan undangundang."
418,hak pengelolaan,"hak yang khusus untuk keperluan pengembangan dan pembangunan kawasan industri, pembangunan perumahan pada umumnya serta proyek-proyek pemerintah pusat/daerah yang khusus diberikan kepada badan-badan hukum yang modalnya sebagian/seluruhnya milik negara."
419,hak pensiun/vested,hak untuk memperoleh manfaat pensiun karyawan yang harus dibayarkan dan tidak diadakan penundaan atas hak tersebut apabila karyawan telah memenuhi jangka waktu minimum untuk menerima hak dimaksud.
420,hak perseorangan/persoonlijk recht,"hak yang memberikan kekuasaan kepada perseorangan untuk menuntut atau menagih pihak tertentu atas haknya, misalnya hak piutang dan hak sewa."
421,hak regres/recht van regres,hak pemegang surat wesel/cek/surat sanggup untuk menagih penarik/endosan/avalis guna mendapat pembayaran jika pihak tertarik menolak melakukan pembayaran.
422,hak retensi,hak menahan atas sesuatu barang yang dijaminkan atau dipakai sebagai jaminan karena piutangnya belum dibayar (dilunasi).
423,hak sewa,hak atas tanah milik orang lain yang diperoleh berdasarkan perjanjian untuk keperluan bangunan selama jangka waktu tertentu dengan membayar uang sewa; hak untuk menikmati barang milik orang lain selama jangka waktu tertentu dengan kewajiban membayar uang sewa dan memelihara dengan sebaik-baiknya.
424,hak subrogasi/subrogatie,hak untuk melakukan penggantian kreditor oleh pihak ketiga yang melunasi utang debitur; pergantian penagih.
425,hak substitusi/substitutie recht,hak yang diberikan kepada seorang pemegang kuasa dalam menangani suatu perkara untuk menunjuk pihak lain sebagai penggantinya apabila pemegang kuasa tersebut berhalangan untuk beracara di pengadilan.
426,hak tanggungan/hypothecation,penjaminan atas barang tidak bergerak dan/atau kapal berukuran tertentu serta barang-barang yang ditentukan oleh pemerintah yang diberikan debitur kepada kreditur untuk jaminan utangnya; penjaminan dibuktikan dengan akta pembebanan hak tanggungan (APHT).
427,hak tuntut/chose in action,"hak untuk menuntut suatu pemenuhan kewajiban atau pemilikan atas barang atau uang berdasarkan perikatan tertentu, seperti hak paten dan hak cipta; hak tuntut digolongkan sebagai barang bergerak yang tidak berwujud."
428,hal verifikasi/subject to verification,"proses pemeriksaan ulang oleh petugas bank atas transaksi yang dilakukan oleh nasabah bank; misalnya, jika nilai nominal cek berbeda dengan yang ditulis oleh nasabah atau saat nasabah menyetor melalui ATM sehingga pegawai bank akan melakukan pemeriksaan untuk mengetahui apakah jumlah setoran tersebut sesuai dengan yang diklaim oleh nasabah."
429,hapus buku/write off,"pinjaman macet yang tidak dapat ditagih lagi dihapusbukukan dari neraca (on-balance sheet) dan dicatat pada rekening administratif (off-balance sheet); penghapusbukuan pinjaman macet tersebut dibebankan pada akun penyisihan penghapusan aktiva produktif; meskipun pinjaman macet tersebut telah dihapusbukukan, hal ini hanya bersifat administratif sehingga penagihan terhadap debitur tetap dilakukan; hasil tagihan pokok pinjaman dibukukan ke rekening penyisihan penghapusan aktiva produktif, sedangkan tagihan bunga dibukukan sebagai pendapatan lain."
430,harga,nilai yang diukur dengan jumlah satuan uang.
431,harga perkiraan sendiri (HPS)/owner estimate,"harga perkiraan sendiri adalah harga yang dikalkulasikan secara keahlian dan berdasarkan data yang dapat dipertanggungjawabkan; harga pasar setempat menjelang dilaksanakannya pengadaan; alat untuk menilai kewajaran harga penawaran termasuk rinciannya dan untuk menetapkan besaran tambahan nilai jaminan pelaksanaan bagi penawaran yang dinilai terlalu rendah, tetapi tidak dapat dijadikan dasar untuk menggugurkan penawaran."
432,harta beku/frozen asset,harta yang tidak dapat dicairkan atau dijual karena ketentuan pihak berwenang.
433,harta bersih/net asset,selisih antara nilal total aktiva dan nilai total pasiva yang dilaporkan dalam neraca.
434,harta pailit/after acquired property,harta yang ditaruh dalam harta pailit setelah putusan pailit dijatuhkan.
435,harta tak-bergerak/real property,kekayaan berupa tanah dan harta tidak bergerak lainnya milik perusahaan.
436,harta/asset,"segala sesuatu yang mempunyai nilai moneter, dimiliki oleh orang atau organisasi, biasanya sebesar biaya atau nilai wajar pasar; aset, biasanya, berupa barang spesifik seperti real estate atau aset berwujud lainnya atau tagihan terhadap pihak lain; sin. aset."
437,hasil pemeriksaan,"hasil akhir dari proses penilaian kebenaran, kepatuhan, kecermatan, kredibilitas, dan keandalan data/informasi mengenai pengelolaan dan tanggung jawab keuangan negara yang dilakukan secara independen, obyektif, dan profesional berdasarkan standar pemeriksaan, yang dituangkan dalam laporan hasil pemeriksaan sebagai Keputusan BPK."
438,hati-hati - kehati-hatian bank/prudential banking,pelaksanaan prinsip kehati-hatian bank untuk meminimalkan risiko usaha operasional bank dengan berpedoman kepada ketentuan bank sentral dan ketentuan intern bank.
439,hedging/cegah risiko,"menutup transaksi jual-beli komoditi, sekuritas, atau valuta sejenis untuk menghindari kemungkinan kerugian karena perubahan harga."
440,hipotek/mortgage/hypothecair verband,1. instrumen utang dengan pemberian hak tanggungan atas properti dan peminjam kepada pemberi pinjaman sebagai jaminan terhadap kewajibannya; dalam hal ini peminjam masih dapat menggunakan atau memanfaatkan properti tersebut; hak tanggungan atas properti gugur setelah kewajibannya dibayar lunas; 2. suatu hak kebendaan – atas benda-benda tak bergerak (Onroerende Goederen) untuk mengambil penggantian dari padanya bagi perlunasan sesuatu perikatan; 3. sama dengan gadai dengan jaminan atas benda-benda tak bergerak (Onroerende Goederen) sewaktu-waktu peminjam uang tak dapat membayar kembali benda-benda tersebut dipakai sebagai pelunasannya [vide: KUH Pdt Psl. 1162].
441,hipotesis,"skenario terburuk dari suatu kasus penyimpangan, yaitu, berdasarkan dugaan,  kemungkinan peristiwa terburuk terjadi. Misalkan dugaan kasus penerimaan uang suap atau kickback, penggelapan, perbedaan kepentingan, penyimpangan dalam penyajian laporan keuangan dan lain–lain."
442,hire purchase/sewa beli,perjanjian sewa dengan hak opsi untuk membeli barang yang disewa; pembelian barang dengan pembayaran angsuran dalam hal hak milik atas barang tersebut baru beralih secara sah ke pihak pembeli setelah ia membayar angsuran terakhir.
443,holding company/perusahaan atasan,perusahaan yang tidak menjalankan kegiatan bisnis sendiri melainkan mengendalikan perusahaan-perusahaan lain dengan cara memiliki sebagian atau seluruh saham dari perusahaanperusahaan tersebut.
444,homologasi/homologa tie,pengesahan hakim atas persetujuan antara debitur dan kreditur konkuren untuk mengakhiri kepailitan.
445,honorarium/loon (bld),"uang jasa, untuk imbalan, upah, honorarium."
446,hukum (ind)/Recht (bld)/ Law (ing)/Recht (jerm)/Droit (pr)/Ius (Lat),"keseluruhan daripada peraturan-peraturan yang mana tiap-tiap orang yang bermasyarakat wajib mentaatinya, bagi pelanggaran terdapat sanksi; demikianlah kata sarjana LAND masih banyak lagi perumusan hukum dari sarjana-sarjana yang lain."
447,hukum acara,ketentuan hukum yang mengatur proses beracara untuk menegakkan hukum materil tertentu sehubungan dengan adanya suatu perkara dalam bidang hukum tertentu tersebut.
448,hukum acara perdata/burgerlijk procesrecht (bld)/procedure of civil law (ing),ketentuan-ketentuan hukum yang mengatur dengan cara bagaimana tertib hukum perdata itu dapat ditegakkan atau dilaksanakan – jelaslah Hukum Acara Perdata adalah hukum yang mengatur cara orang berproses atau berperkara pada sidang (pengadilan) untuk memperoleh sesuatu putusan dari pengadilan atau hakim perdata.
