No,Istilah,Definisi
1323,roya/reconveyance,penghapusan pengikatan suatu agunan berupa tanah sehingga hak kepemilikan atas tanah bersangkutan kembali kepada pemilik aslinya.
1324,royalti/royalty,"jumlah yang dibayarkan untuk penggunaan properti, seperti paten, hak cipta, atau sumber alam; misalnya, pencipta mendapat bayaran royalti ketika ciptaannya diproduksi dan dijual; penulis dapat memperoleh royalti ketika buku hasil karya tulisannya dijual; pemilik tanah menyewakan tanahnya ke perusahaan minyak atau perusahaan penambangan akan memperoleh royalti atas dasar jumlah minyak yang dihasilkan dari tanah tersebut."
1325,rugi – kerugian total/total losses,seluruh kerugian yang diderita perusahaan atas kegiatan operasional dan non operasional dalam periode tertentu.
1326,rugi – kerugian/loss,jumlah pengeluaran yang lebih besar dibandingkan dengan pendapatan yang diterima; dalam asuransi dapat pula diartikan sebagai besarnya pembayaran yang harus diberikan oleh penanggung kepada tertanggung atas terjadinya hal yang diasuransikan.
1327,ruilslag/tukar guling,penukaran lahan yaitu terjadinya penukaran terhadap tanah-tanah yang dipergunakan atau dipakai dan hak dari pemerintah pusat ataupun pemerintah daerah untuk ditukar tanahnya dengan tanah lainnya.
1328,safeguards/penyelamatan,"dalam perdagangan internasional antar negara berarti tindakan pemerintah suatu negara untuk mengamankan perekonomian nasionalnya yang terancam bahaya karena derasnya arus impor barang, sehingga mengalahkan dan membahayakan industri lokal yang memproduksi barang serupa; tindakan penyelamatan tersebut misalnya dengan menerapkan hambatan perdagangan sementara, atau penundaan untuk sementara pelaksanaan kewajibannya sesuai dengan prinsip dalam GATT."
1329,saham aktif/active stock,saham yang banyak diperdagangkan di bursa.
1330,saham tak-aktif/inactive stock,saham yang jarang diperjualbelikan; saham tersebut tidak likuid sehingga para investor cenderung tidak tertarik pada saham tersebut.
1331,saham/stock,"surat bukti kepemilikan atau bagian modal suatu perseroan terbatas yang dapat diperjualbelikan, baik di dalam maupun di luar pasar modal yang merupakan klaim atas penghasilan dan aktiva perusahaan; memberikan hak atas deviden sesuai dengan bagian modal disetor seperti yang ditentukan dalam anggaran dasar perusahaan."
1332,saldo,"sisa, selisih antara debit dan kredit."
1333,sale and lease back/jual dan sewa kembali,"suatu perjanjian antara penjual dan pembeli dalam hal penjual setelah menjual barangnya kepada pembeli, kemudian bertindak sebagai penjual barang yang sama dan pihak pembeli yang menjadi pihak yang menyewakan."
1334,sale tax,pajak penjualan.
1335,sales contract/kontrak jual beli,perjanjian atau kontrak jual beli antara penjual dan pembeli mengenai suatu komoditi atau barang tertentu; sering disebut juga dengan istilah sales agreement.
1336,sales invoice/faktur dagang,"formulir atau dokumen penagihan pembayaran atas pemesanan pembelian barang, tercantum di dalamnya jumlah satuan barang, nama atau jenis barang, harga dan ongkos pengiriman."
1337,satuan kerja,kuasa pengguna anggaran/pengguna barang yang merupakan bagian dari suatu unit organisasi pada kementerian negara/lembaga yang melaksanakan satu atau beberapa kegiatan dari suatu program.
1338,satuan kerja pengelola keuangan daerah (SKPKD),"perangkat daerah pada pemerintah daerah selaku pengguna anggaran/pengguna barang, yang juga melaksanakan pengelolaan keuangan daerah."
1339,satuan kerja perangkat daerah (SKPD),"organisasi/lembaga pada pemerintah daerah yang bertanggungjawab kepada gubernur/bupati/walikota dalam rangka penyelenggaraan pemerintahan yang terdiri dari sekretaris daerah, dinas daerah dan lembaga teknis daerah, kecamatan, desa, dan satuan polisi pamong praja sesuai dengan kebutuhan daerah."
1340,saving clause/klausul pemisahan,"suatu klausul dalam suatu undang-undang atau suatu kontrak yang menyatakan bahwa apabila ada bagian dari undang-undang atau kontrak tersebut yang tidak sah, maka bagian lain dari undang-undang atau kontrak tersebut tetap sah; klausul yang menegaskan bahwa bagian tertentu dari suatu undang-undang atau kontrak akan tetap sah meskipun bagian lainnya dinyatakan tidak sah; klausul ini juga disebut severability or separability clause."
1341,scriptum identatum,surat-surat dokumen.
1342,scriptum obligatorum,surat kuasa.
1343,seal/segel/materai/cap resmi,tanda berupa logo atau simbol resmi dan sah yang melekat atau dilekatkan pada dokumen tertulis sebagai bukti keabsahan serta memberikan kekuatan hukum.
1344,sebab,alasan terjadi perbedaan antara kondisi nyata dengan kriteria yang seharusnya.
1345,second mortgage,"pemegang harta hipotek, dihipotekkan lagi kepada orang lain."
1346,secondary evidence,bukti yang tidak berasal dari sumber pertama.
1347,secured debt/utang dengan jaminan,perjanjian utang piutang yang disertai dengan jaminan oleh debitur kepada kreditur; pinjaman atau utang yang dibebani atau diikat dengan hak tanggungan untuk menjamin pelunasannya.
1348,secured loan/kredit berjaminan,kredit atau perjanjian utang-piutang yang disertai dengan jaminan yang diberikan oleh debitur kepada kreditur.
1349,secured transaction/transaksi berjaminan,transaksi atau perjanjian yang dilekati atau didukung dengan jaminan pemenuhan prestasi atau kewajiban dari debitur kepada kreditur.
1350,securities/sekuritas/efek,"bukti utang-piutang atau bukti pemilikan modal yang dapat diperdagangkan, meliputi obligasi, saham, hipotik, aksep, promes, wesel, sertifikat deposito, dan konosemen, sekuritas kredit, waran, opsi."
1351,security agreement/perjanjian jaminan atau tanggungan,perjanjian asesor atau pelengkap terhadap perjanjian pokoknya yang berisi pemberian jaminan atas isi perjanjian pokok yang diberikan oleh debitur kepada kreditur.
1352,seizure/perampasan,"tindakan pengambilalihan hak-hak milik pribadi atas suatu benda secara melawan hukum, biasanya ditujukan untuk tindakan yang dilakukan oleh pemerintah terhadap individu."
1353,sekuritas kepemilikan/equity securities,surat berharga sebagai bukti kepemilikan yang dapat dipindahtangankan; surat berharga tersebut dapat berupa saham istimewa atau saham biasa.
1354,sekuritas tertukarkan/convertible stock/convertible securities,"surat-surat berharga yang dapat ditunaikan dengan segera, atau surat berharga berbunga tetap yang dapat ditukar dengan saham biasa, berdasarkan perjanjian."
1355,sekuritas/securities,"bukti utang piutang atau bukti pemilikan modal dalam bentuk surat berharga yang dapat diperdagangkan, misalnya obligasi, saham, hipotek, wesel, promes, sertifikat deposito, kupon, skrip, jaminan, right, dan opsi."
1356,sekuritisasi/securitization,"pengonversian sekelompok piutang dalam jenis yang sama (biasanya kredit) menjadi surat berharga yang dapat diperdagangkan, meliputi piutang pokok dan bunga; kredit yang disekuritisasikan biasanya ialah kredit yang berkualitas tinggi yang dilakukan untuk meningkatkan pendapatan dan menurunkan tingkat risiko kredit; dengan konversi kredit dan piutang, bank dapat meningkatkan rasio modal dan menerbitkan kredit-kredit yang baru; surat berharga yang akan dijual oleh bank kepada investor dijamin oleh aset yang akan dikonversikan sehingga sering disebut sebagai sekuritas terdukung aset (asset backed securities)."
1357,sekutu komanditer/limited partner,sekutu perusahaan yang tidak ikut aktif dalam menjalankan kegiatan perusahaan tetapi hanya menyerahkan modal atau barangnya sebagai tanda ikut serta dalam pemilikan perusahaan.
1358,self assessment,penetapan beban pajak sendiri yang dilakukan oleh perorangan atau perusahaan kemudian melaporkan kepada kantor pajak untuk menilai kewajaran laporan tersebut.
1359,self financing/swabiaya,"bagian dari keutuhan dana untuk pembiayaan yang dapat disediakan sendiri oleh pemohon kredit, sedangkan kekurangannya diberikan oleh bank atau pihak pemberi kredit."
1360,sero - perseroan firma/partnership,kerja sama antara dua orang atau lebih yang secara bersama-sama mengorganisasi perusahaan dengan maksud untuk mencari laba; setiap mitra biasanya memasukkan modalnya ke dalam perusahaan serta ikut memimpin dan bertanggung jawab secara tanggung renteng apabila perusahaan menderita kerugian.
1361,sero - perseroan komanditer/commanditaire vennoo tschap,firma yang di antara para anggotanya terdapat seorang atau lebih yang tidak turut campur dalam pengurusan dan tidak berhak bertindak untuk dan atas nama firma serta mengikat firma dengan pihak ketiga dan tanggung jawabnya terbatas sampai dengan sejumlah uang yang dimasukkannya ke dalam firma.
1362,sero - perseroan terbatas/limited company,"perusahaan yang berbentuk badan hukum, didirikan dengan modal yang terbagi atas saham, memenuhi persyaratan yang ditetapkan dalam Undang-Undang Perseroan Terbatas serta peraturan pelaksanaannya; tanggung jawab pemegang saham terbatas sebesar jumlah nominal saham yang dimiliki."
1363,sero - perseroan tidak terbatas/unlimited company,"persekutuan bukan badan hukum yang bertanggung jawab terhadap utangnya, tidak hanya terbatas pada besarnya kekayaan persekutuan, tetapi termasuk kekayaan pengurus."
1364,sero – perseroan/corporation,persekutuan antara dua orang atau lebih untuk mencapai tujuan bersama.
1365,serta - penyertaan bank,"penanaman dana bank dalam bentuk saham perusahaan lain untuk tujuan investasi jangka panjang, baik dalam rangka pendirian, ikut serta dalam lembaga keuangan lain, penyelamatan kredit atau lainnya yang dilakukan tidak melalui pasar modal."
1366,sertifikat analisis/certificate of analysis,"surat keterangan dari pihak ketiga yang berwenang atau produsen yang diperlukan untuk suatu kontrak penjualan dan penyerahan barang, yang membuktikan bahwa barang-barang tersebut telah diperiksa."
1367,sertifikat asal barang/certificate of origin,"dokumen yang menyatakan negara asal dari barang yang diperdagangkan, biasanya diperlukan dalam perdagangan internasional."
1368,sertifikat asuransi/certificate of insurance,keterangan bahwa polis asuransi telah diterbitkan dengan menunjukkan jumlah dan jenis barang yang dipertanggungkan secara terperinci; polis tersebut dapat digunakan sebagai bukti untuk mereasuransikan kepada asuradur.
1369,sertifikat deposito/certificate of deposit,simpanan dalam bentuk deposito yang sertifikat bukti penyimpanannya dapat dipindahtangankan.
1370,sertifikat mutu/certificate of quality,sertifikat yang menerangkan bahwa kualitas atau mutu barang telah sesuai dengan persyaratan yang ditetapkan oleh pembeli dan ditandatangani oleh pejabat berwenang.
1371,sertifikat pemeriksaan/certificate of inspection,surat keterangan yang menyatakan bahwa kondisi barang yang akan dikirim dalam keadaan baik sebelum barang tersebut terangkut/dikapalkan.
1372,sertifikat saham/certificate of stock,"1. sertifikat yang diterbitkan oleh sebuah perseroan terbatas bukan bank; 2. surat bukti kepemilikan sejumlah saham suatu perseroan; dalam sertifikat tersebut dicantumkan nama penerbit, jumlah nominal atau mewakili nilai yang dinyatakan, atau deklarasi nilai bukan nominal, dan hak pemegang saham; sertifikat ini dapat diperdagangkan seluruhnya dengan menyerahkan kembali sertifikat tersebut kepada penerbit atau melalui pialang untuk diadakan pembahasan."
1373,sertifikat/certificate,"1. suatu akta yang sengaja dibuat untuk tanda bukti tentang adanya suatu peristiwa hukum tertentu; 2. tanda bukti mengenai sesuatu hal yang dapat digunakan untuk mendokumentasikan suatu fakta, seperti akta kelahiran, telah menyelesaikan atau mengikuti suatu seminar."
1374,servitude/hak lewat,hak kebendaan berupa hak beban di atas lahan atau tanah milik orang lain untuk kepentingan orang yang meletakkan beban tersebut karena misalnya letak tanah mereka berdampingan.
1375,setoran jaminan/marginal deposit,"uang yang diterima bank sebagai jaminan yang akan diperhitungkan pada waktu penyelesaian suatu transaksi, misalnya dalam pembukaan L/C dalam negeri dan luar negeri."
1376,settlement of disputes/penyelesaian sengketa,"sistem dan prosedur penyelesaian sengketa hukum baik yang dilakukan melalui lembaga pengadilan, maupun melalui lembaga arbitrase, konsultasi, konsiliasi atau mediasi."
1377,severable contract/kontrak terpisah,"suatu kontrak yang secara hukum dinyatakan terpisah dari kontrak pokoknya, misalnya dalam hukum arbitrase suatu perjanjian arbitrase oleh hukum dapat dinyatakan sebagai perjanjian yang terpisah dari perjanjian pokoknya meskipun isi perjanjian arbitrase tersebut berkenaan dengan cara penyelesaian sengketa yang timbul dari pelaksanaan isi perjanjian pokoknya, oleh karena dinilai sebagai kontrak yang terpisah maka ketakabsahan kontrak pokok tak berpengaruh terhadap kontrak atau perjanjian arbitrase itu."
1378,sewa beli/lease,"perjanjian sewa-menyewa, biasanya mengenai tanah, gedung atau peralatan modal selama jangka waktu tertentu dengan pembayaran sewa berkala, termasuk kewajiban pemilik seperti pajak, penyusutan dan asuransi; pada akhir masa sewa, biasanya, penyewa diberikan opsi untuk meneruskan jangka waktu sewa atau membeli barang sewa tersebut."
1379,shareholder,pemegang saham.
1380,shareholders general meeting/rapat umum pemegang saham,organ perseroan yang memegang kekuasaan tertinggi dalam perseroan dan memegang segala wewenang yang tidak diserahkan kepada direksi atau komisaris.
1381,shares/saham/surat saham,bukti pemilikan modal perseroan terbatas yang memberikan berbagai hak kepada pemilik atau pemegangnya sesuai dengan ketentuan anggaran dasar pendiriannya.
1382,shifting of burden of proof/pengalihan beban pembuktian,"kewajiban untuk membuktikan fakta di depan hakim yang bergeser atau beralih dari pihak yang seharusnya membuktikan, yaitu pihak yang mendalilkan, ke pihak lawan."
1383,short-term loan/pinjaman jangka pendek,pinjaman atau kredit yang berjangka waktu maksimum 1 tahun.
1384,sight draft/wesel lihat/wesel atas unjuk,"surat wesel yang pembayarannya dilakukan saat diunjukkan atau diperlihatkan kepada pihak tertarik, wesel ini tidak dapat diperdagangkan kecuali apabila diberikan tenggang waktu bagi pembayarannya."
1385,silent partner/mitra pasif,peserta atau mitra dalam persekutuan komanditer yang tidak mempunyai wewenang kepengurusan dan tanggung jawabnya terbatas sampai jumlah uang yang dimasukkan ke dalam persekutuan tersebut.
1386,sinking fund/dana pelunasan utang,dana perusahaan yang digunakan untuk membayar utang jangka panjang yang dihimpun dengan menyisihkan sebagian laba secara berkala.
1387,sisa lebih perhitungan anggaran (SiLPA),selisih lebih realisasi penerimaan dan pengeluaran anggaran selama satu periode anggaran.
1388,sistem akuntansi barang milik negara (SABMN),sub sistem dari SAI yang merupakan serangkaian prosedur yang saling berhubungan untuk mengolah dokumen sumber dalam rangka menghasilkan informasi untuk penyusunan neraca dan laporan BMN serta laporan manajerial lainnya sesuai ketentuan yang berlaku.
1389,sistem akuntansi instansi (SAI),"serangkaian prosedur manual maupun yang terkomputerisasi mulai dari pengumpulan data, pencatatan, pengikhtisaran sampai dengan pelaporan posisi keuangan dan operasi keuangan pada Kementerian Negara/Lembaga."
1390,sistem akuntansi kas umum negara (SAKUN),sub SiAP yang menghasilkan Laporan Arus Kas dan Neraca Kas Umum Negara yang selanjutnya disebut Neraca KUN.
1391,sistem akuntansi pemerintah pusat (SAPP),"serangkaian prosedur manual maupun yang terkomputerisasi mulai dari pengumpulan data, pencatatan, pengikhtisaran sampai dengan pelaporan posisi keuangan dan operasi keuangan Pemerintah Pusat."
1392,sistem akuntansi pusat (SiAP),"serangkaian prosedur manual maupun yang terkomputerisasi mulai dari pengumpulan data, pencatatan, pengikhtisaran sampai dengan pelaporan posisi keuangan dan operasi keuangan pada Kementerian Keuangan selaku Bendahara Umum Negara."
1393,sistem akuntansi umum (SAU),sub SiAP yang menghasilkan Laporan Realisasi Anggaran Pemerintah Pusat dan Neraca.
1394,sistem pengendalian intern (SPI),"suatu proses yang integral pada tindakan dan kegiatan yang dilakukan secara terus menerus oleh pimpinan dan seluruh pegawai untuk memberikan keyakinan memadai atas tercapainya tujuan organisasi melalui kegiatan yang efektif dan efisien, keandalan pelaporan keuangan, pengamanan aset negara, dan ketaatan terhadap peraturan perundang-undangan."
1395,sistem pengendalian intern pemerintah (SPIP),sistem pengendalian intern yang diselenggarakan secara menyeluruh di lingkungan pemerintah pusat dan pemerintah daerah.
1396,sistem perbankan nasional/national banking system,"sistem yang mengatur mengenai segala sesuatu yang menyangkut bank, mencakup kelembagaan, kegiatan usaha, serta cara dan proses melaksanakan kegiatan usahanya secara keseluruhan; di Indonesia ketentuan mengenai perbankan nasional terakhir diatur dalam Undang-Undang Nomor 7 Tahun 1992 tentang Perbankan dan Undang-Undang Nomor 10 Tahun 1998 tentang Perubahan atas Undang-Undang Nomor 7 tahun 1992 tentang Perbankan; perbankan Indonesia bertujuan menunjang pelaksanaan pembangunan nasional dalam rangka meningkatkan pemerataan, pertumbuhan ekonomi, dan stabilitas nasional ke arah peningkatan kesejahteraan rakyat banyak; menurut jenisnya, bank di Indonesia terdiri atas bank umum dan bank perkreditan rakyat."
1397,sita – penyitaan/sequestration,"1. penitipan barang sengketa kepada pihak ketiga, yang ditunjuk oleh pihak-pihak yang bersengketa atau oleh pengadilan; pihak ketiga wajib menyerahkan barang sengketa itu kepada pihak yang dinyatakan berhak setelah terdapat keputusan pengadilan; 2. pengambilalihan harta seseorang kemudian dijual untuk melunasi utangnya; apabila harga jual harta tersebut lebih besar daripada jumlah utangnya, sisa hasil penjualan harus dikembalikan kepada debitur."
1398,sita eksekusi/executoricalbeslag,penahanan barang milik yang kalah perkara karena tidak memenuhi keputusan hakim sebagai pengganti jumlah uang yang harus dibayar dan ongkos-ongkos untuk menjalankan putusan tersebut.
1399,sita gadai/pand beslag,penyitaan atas barang-barang gadai yang dikuasai oleh kreditur karena debitur tidak mampu menebus kembali barang gadainya pada saat jatuh tempo.
1400,slip kredit/credit slip/credit voucher,"dokumen yang menjelaskan pengkreditan kembali rekening pemegang kartu, yang membuktikan bahwa pemegang kartu telah mengembalikan barang yang dibeli kepada penjual."
1401,sole agent/agen tunggal,"satu-satunya agen di suatu wilayah tertentu yang ditunjuk oleh prinsipalnya untuk melakukan tindakan hukum tertentu, biasanya berupa tindakan untuk menjual produk dan/atau jasa dari prinsipal."
1402,sole proprietorship/perusahaan perseorangan,perusahaan yang bukan berbadan hukum yang dimiliki oleh perseorangan dengan tanggung jawab pribadi.
1403,solvency/solvabilitas,kemampuan membayar semua utang kepada kreditur pada saat jatuh tempo dengan perhitungan bahwa nilai harta lebih tinggi daripada nilai semua utang.
1404,somasi/call,peringatan tertulis melalui pengadilan dan kreditur kepada debitur yang cedera janji untuk memenuhi kewajibannya dalam batas waktu tertentu.
1405,specific limitation on trade/pembatasan khusus perdagangan,"tindakan pemerintah untuk membatasi impor atau ekspor suatu komoditi dengan menegaskan jumlah atau nilainya, biasanya eksportir atau importir harus mendapatkan izin pemerintah untuk setiap transaksi ekspor atau impor yang akan dilakukannya."
1406,standar,1. ukuran tertentu yang dipakai sebagai patokan atau ukuran baku; 2. sesuatu yang dianggap tetap nilainya sehingga dapat dipakai sebagai ukuran nilai (harga).
1407,standar akuntansi,pedoman dan ukuran tentang pencatatan dan pelaporan berkaitan dengan transaksi keuangan yang disusun oleh suatu badan yang berwenang menurut undang-undang.
1408,standar akuntansi pemerintah (SAP),prinsip-prinsip akuntansi yang diterapkan dalam menyusun dan menyajikan laporan keuangan pemerintah.
1409,standar pemeriksaan keuangan negara (SPKN),"patokan untuk melakukan pemeriksaan pengelolaan dan tanggung jawab keuangan negara yang meliputi standar umum, standar pelaksanaan pemeriksaan, dan standar pelaporan yang wajib dipedomani oleh BPK dan/atau pemeriksa."
1410,standby letter of credit/surat kredit siaga,surat kredit dalam perdagangan internasional yang berfungsi sebagai jaminan bagi pihak pembeli terhadap kerugian yang dideritanya akibat dari penjual yang ingkar janji.
1411,stare decisis/preseden,suatu prinsip hukum menurut tradisi Common Law dalam hal mana suatu pengadilan yang menghadapi masalah tertentu akan menerapkan atau mengikuti keputusan pengadilan sebelumnya yang memuat masalah hukum yang sama dengan yang dihadapi oleh pengadilan tersebut.
1412,state-owned enterprises/perusahaan Negara,perusahaan yang seluruh modalnya dimiliki oleh negara.
1413,stock option/opsi saham,"hak opsi atau hak pilih untuk membeli sejumlah saham perusahaan pada tingkat harga tertentu, hak ini diberikan misalnya kepada karyawan atau para pemegang saham perusahaan, sering disebut juga stock right."
1414,stock split/pemecahan saham,"pemecahan saham perseroan yang telah ada menjadi dua atau lebih saham baru dengan harga yang lebih kecil, sehingga dari satu saham lama dapat dihasilkan dua atau lebih saham baru yang bila dijumlahkan harganya lebih besar daripada harga satu saham lama, tindakan ini dilakukan oleh perseroan yang bersangkutan apabila harga saham tersebut dinilai terlalu tinggi di bursa saham sehingga menyulitkan investor."
1415,stock warrant/waran saham/surat pembelian saham,suatu sertifikat yang dijual kepada masyarakat umum yang memberi hak kepada pemiliknya untuk membeli sejumlah saham pada waktu dan dengan harga tertentu.
1416,straight bill of lading/konosemen rekta/konosemen atas nama,"surat muatan atau konosemen yang mencantumkan nama penerima barang di pelabuhan tujuan dengan klausul tidak kepada order, konosemen semacam ini hanya dapat dialihkan dengan cara cessie."
1417,straight letter of credit/surat kredit langsung,surat kredit yang dapat segera dibayar pada waktu penyerahan surat wesel atas unjuk yang disertai dokumen lengkap.
1418,strict liability/tanggung jawab hukum tanpa kesalahan,prinsip pertanggungjawaban hukum yang dapat dijatuhkan terhadap seseorang atau badan hukum tanpa mensyaratkan adanya unsur kesalahan.
1419,suap (bribe),"pemberian sesuatu secara terpaksa, sifatnya melawan hukum, dengan tujuan melancarkan pengurusan suatu kepentingan."
1420,subrogasi/subrogation,"pengalihan kreditur kepada pihak lain yang telah melakukan pembayaran atas utang debitur sehingga pihak lain tersebut menggantikan kedudukan sebagai kreditur; dengan demikian, segala hak dan kewajiban debitur beralih kepadanya."
1421,subrogation/subrogasi,"penggantian kreditur berikut pemindahan hak-haknya kepada pihak ketiga dengan melakukan pembayaran kepadanya, sehingga dengan demikian pihak ketiga tersebut menggantikan kedudukan kreditur terhadap debitur (Pasal 1400 s.d. 1403 KUHPerdata)."
1422,subsidi/subsidy,"bantuan keuangan yang diberikan oleh pemerintah kepada pihak tertentu berdasarkan pertimbangan bahwa pemberian bantuan tersebut digunakan untuk kepentingan umum, misalnya untuk pengendalian harga bahan kebutuhan pokok atau sumbangan dana pendidikan."
1423,subsidiary company/anak perusahaan,suatu perusahaan yang dikendalikan oleh perusahaan lain sebagai induknya karena sebagian besar atau seluruh modalnya dimiliki oleh perusahaan induk tersebut.
1424,supervisi,"pengawasan utama, pengontrol tertinggi, operasional."
1425,surat berharga antisipasi pajak/tax anticipation note,"surat berharga jangka pendek yang dikeluarkan oleh pemerintah pusat atau pemerintah daerah untuk membiayai suatu proyek senilai perkiraan pajak yang akan diterima, yang direncanakan sebagai pelunasan surat berharga tersebut; surat itu dikeluarkan dengan diskonto, berjangka waktu kurang dari satu tahun, dan berakhir baik pada tanggal tertentu pada masa akan dating maupun pada saat penerimaan tagihan pajak."
1426,surat berharga atas bawa/toonder papier,surat berharga yang mencantumkan atau tidak mencantumkan nama penerima disertai klausul atau kepada pembawa”; surat ïni dipindahtangankan dengan cara menyerahkan begitu saja.
1427,surat berharga beragunan/collateral trust note,1. surat berharga jangka pendek yang diterbitkan dengan jaminan hak tanggungan; penerbitan surat berharga ini didahului dengan suatu perjanjian yang dijamin dengan hak tanggungan; pemegang surat berharga mempunyai hak tagih yang sama dengan kreditur pemegang hak tanggungan; 2. surat berharga jangka pendek yang dijamin oleh saham prioritas ataupun surat berharga lainnya.
1428,surat berharga finansial/financial paper,bentuk pinjaman jangka pendek yang tidak didukung oleh transaksi yang bersifat komersial atau pemindahan hak atas kepemilikan barang tetap yang dinyatakan dalam suatu perjanjian.
1429,surat berharga komersial/commercial paper,"surat utang jangka pendek, surat utang tanpa jaminan di pasar uang, yang diterbitkan oleh perusahaan terkenal ataupun lembaga keuangan, dengan jangka waktu antara 2 s.d. 270 hari; surat berharga yang paling banyak dalam jangka waktu 30 hari; penerbit surat berharga ini harus diperingkat oleh lembaga pemeringkat yang diakui; lembaga pemeringkat surat berharga jangka pendek di Indonesia pada saat ini adalah PT Pefindo."
1430,surat berharga pasar uang/money market instruments,"surat utang yang diterbitkan oleh badan usaha swasta, pemerintah, dan agen pemerintah, umumnya berjangka waktu maksimum satu tahun; Surat utang yang demikian merupakan investasi yang sangat likuid; contohnya, Sertifikat Bank Indonesia, surat berharga pasar uang, surat berharga komersial, termasuk di dalamnya surat utang jangka pendek, akseptasi bank, surat berharga komersial, surat berharga jangka pendek pemerintah daerah yang bebas pajak, dan sertifikat deposito bank yang dapat dijual."
